{
  "$schema": "https://json-schema.org/draft/2020-12/schema",
  "type": "object",
  "required": ["schemaVersion", "proofstreamCommit", "sources", "claims"],
  "properties": { "schemaVersion": { "type": "string" }, "proofstreamCommit": { "type": "string" }, "sources": { "type": "array" }, "claims": { "type": "array" } }
}
