{
  "schemaVersion": "1.0.0",
  "proofstreamCommit": "ce754c1a6c56ad65657b9482ffca9aa96ee8cfad",
  "sources": [
    "contracts/out/WorkStream.sol/WorkStream.json",
    "contracts/out/StreamRegistry.sol/StreamRegistry.json",
    "README.md",
    "EVIDENCE.md",
    ".env.example",
    "web/lib/chain.ts"
  ],
  "claims": [
    {
      "id": "chain.arc-testnet",
      "classification": "verified",
      "source": "web/lib/chain.ts"
    },
    {
      "id": "deployment.workstream-address",
      "classification": "conflicted",
      "source": "README.md and EVIDENCE.md"
    },
    {
      "id": "skill.release-status",
      "classification": "experimental",
      "source": "manifest.json"
    }
  ]
}
